{
  "schema_version": "pgworkbench.operation-benchmark-spec/v1",
  "id": "massive-dml/offline-bulk-load-indexed",
  "name": "Massive DML offline bulk load with maintained indexes",
  "description": "Repeated disposable bulk-load experiment with secondary indexes maintained while rows are inserted.",
  "classification": "descriptive-engineering",
  "decision_eligible": false,
  "experiment_spec": "massive-dml/offline-bulk-load-indexed",
  "trials": 5,
  "max_cv_pct": 15,
  "supported_runtimes": ["docker", "native"],
  "measurement": {
    "basis": "operation-result",
    "result_path": "artifacts/operation-result.json",
    "metric": "total_ms",
    "unit": "milliseconds",
    "direction": "lower-is-better",
    "scope": "PostgreSQL server clock around table creation, required secondary-index creation, and row insertion; ANALYZE is excluded."
  },
  "assurance": "A passing series proves exact repeated runs, linked-run integrity, result parsing, and aggregate reproducibility for this disposable environment. It does not prove production capacity, universal superiority, TPC compliance, or causal equivalence with a separately scheduled series."
}
